{
  "$schema": "https://json-schema.org/draft/2020-12/schema",
  "$id": "https://raw.githubusercontent.com/juxstin1/archmap-plugin/main/schemas/marketplace.schema.json",
  "title": "Claude Code marketplace manifest",
  "description": "Schema for .claude-plugin/marketplace.json. Users add this as a marketplace via `/plugin marketplace add <owner>/<repo>`; the 'name' field is what they then type as @<name> in `/plugin install <plugin>@<name>`.",
  "type": "object",
  "required": ["name", "plugins"],
  "additionalProperties": false,
  "properties": {
    "name": {
      "type": "string",
      "pattern": "^[a-z0-9][a-z0-9-]*$",
      "minLength": 1,
      "maxLength": 64,
      "description": "Kebab-case marketplace name. Shown to users as @<name> after install."
    },
    "owner": {
      "type": "object",
      "required": ["name"],
      "additionalProperties": false,
      "properties": {
        "name": { "type": "string", "minLength": 1 },
        "email": { "type": "string", "format": "email" },
        "url": { "type": "string", "format": "uri" }
      }
    },
    "metadata": {
      "type": "object",
      "additionalProperties": true,
      "properties": {
        "description": { "type": "string", "maxLength": 500 }
      }
    },
    "plugins": {
      "type": "array",
      "minItems": 1,
      "items": {
        "type": "object",
        "required": ["name", "source"],
        "additionalProperties": false,
        "properties": {
          "name": { "type": "string", "pattern": "^[a-z0-9][a-z0-9-]*$" },
          "source": { "type": "string", "minLength": 1 },
          "version": {
            "type": "string",
            "pattern": "^\\d+\\.\\d+\\.\\d+(-[A-Za-z0-9.-]+)?(\\+[A-Za-z0-9.-]+)?$"
          },
          "description": { "type": "string", "maxLength": 500 },
          "author": {
            "oneOf": [
              { "type": "string" },
              {
                "type": "object",
                "required": ["name"],
                "properties": {
                  "name": { "type": "string" },
                  "email": { "type": "string", "format": "email" },
                  "url": { "type": "string", "format": "uri" }
                }
              }
            ]
          },
          "license": { "type": "string" },
          "homepage": { "type": "string", "format": "uri" },
          "repository": { "type": "string", "format": "uri" },
          "keywords": {
            "type": "array",
            "items": { "type": "string" },
            "uniqueItems": true
          }
        }
      }
    }
  }
}
